[
  {
    "id": "1",
    "slug": "griffs-weekly-9-ball-vegas",
    "tournament_name": "Griff's Weekly 9-Ball",
    "recurring_or_one_time": "recurring",
    "room_id": "1",
    "roomSlug": "griffs-las-vegas",
    "room": "Griff's Bar & Billiards",
    "city": "Las Vegas",
    "state": "Nevada",
    "tournament_director": "",
    "entry_fee": "$25",
    "added_money": "$250 added",
    "payout_structure": "Top 25% paid",
    "race_format": "Race to 5",
    "discipline": "9-ball",
    "fargo_cap": "Open",
    "handicap_rules": "Handicapped by FargoRate",
    "break_rules": "Alternate Break",
    "alternate_break": true,
    "start_time": "7:30 PM",
    "registration_deadline": "7:00 PM",
    "weekly_recurring_day": "Wednesday",
    "monthly_special_flags": false,
    "flyer_image": "/images/feature-9ball.jpg",
    "registration_link": "https://griffslv.com/tournaments",
    "contact_info": "(702) 222-1011",
    "player_capacity": 64,
    "bracket_system_used": "Challonge",
    "livestream_link": "https://youtube.com/@GriffsLV",
    "source_attribution": ["Official website", "Facebook page"]
  },
  {
    "id": "2",
    "slug": "bull-shooters-friday-9-ball",
    "tournament_name": "Friday Night 9-Ball Action",
    "recurring_or_one_time": "recurring",
    "room_id": "2",
    "roomSlug": "bull-shooters-phoenix-az",
    "room": "Bull Shooters",
    "city": "Phoenix",
    "state": "Arizona",
    "tournament_director": "",
    "entry_fee": "$20",
    "added_money": "$100 added at 16 players",
    "payout_structure": "Auction + Entry",
    "race_format": "Race to 4/3",
    "discipline": "9-ball",
    "fargo_cap": "Open",
    "handicap_rules": "No handicap",
    "break_rules": "Winner Break",
    "alternate_break": false,
    "start_time": "8:00 PM",
    "registration_deadline": "7:30 PM",
    "weekly_recurring_day": "Friday",
    "monthly_special_flags": false,
    "flyer_image": "/images/feature-room.jpg",
    "registration_link": "https://bullshooters-az.com",
    "contact_info": "(602) 439-0988",
    "player_capacity": 32,
    "bracket_system_used": "Paper Bracket",
    "livestream_link": "",
    "source_attribution": ["Facebook page"]
  },
  {
    "id": "3",
    "slug": "texas-open-9-ball-championship-2024",
    "tournament_name": "Texas Open 9-Ball Championship",
    "recurring_or_one_time": "one-time",
    "room_id": "3",
    "roomSlug": "skinny-bobs-austin-tx",
    "room": "Skinny Bob's Billiards",
    "city": "Round Rock",
    "state": "Texas",
    "tournament_director": "Kim & John",
    "entry_fee": "$150",
    "added_money": "$10,000 added",
    "payout_structure": "Guaranteed 1st place $5,000",
    "race_format": "Race to 9",
    "discipline": "9-ball",
    "fargo_cap": "Open",
    "handicap_rules": "Pro Event - Open",
    "break_rules": "Winner Break",
    "alternate_break": false,
    "start_time": "10:00 AM",
    "registration_deadline": "Sep 1",
    "weekly_recurring_day": "",
    "monthly_special_flags": true,
    "flyer_image": "/images/feature-player.jpg",
    "registration_link": "https://www.skinnybobs.com/texas-open",
    "contact_info": "(512) 733-1111",
    "player_capacity": 128,
    "bracket_system_used": "CompuSport",
    "livestream_link": "https://www.youtube.com/user/PoolActionTV",
    "source_attribution": ["Official website"]
  },
  {
    "id": "4",
    "slug": "amsterdam-billiards-pro-am-9-ball",
    "tournament_name": "Amsterdam Pro-Am 9-Ball",
    "recurring_or_one_time": "recurring",
    "room_id": "5",
    "roomSlug": "amsterdam-billiards-nyc",
    "room": "Amsterdam Billiards & Bar",
    "city": "New York",
    "state": "New York",
    "tournament_director": "",
    "entry_fee": "$35",
    "added_money": "$500 added",
    "payout_structure": "Top 16 paid",
    "race_format": "Race to 7",
    "discipline": "9-ball",
    "fargo_cap": "Open",
    "handicap_rules": "ABCD Handicaps",
    "break_rules": "Alternate Break",
    "alternate_break": true,
    "start_time": "1:00 PM",
    "registration_deadline": "12:30 PM",
    "weekly_recurring_day": "Sunday",
    "monthly_special_flags": false,
    "flyer_image": "/images/hero-table.jpg",
    "registration_link": "https://amsterdambilliards.com",
    "contact_info": "(212) 995-0333",
    "player_capacity": 64,
    "bracket_system_used": "Challonge",
    "livestream_link": "",
    "source_attribution": ["Official website"]
  },
  {
    "id": "5",
    "slug": "big-tyme-weekly-8-ball",
    "tournament_name": "Big Tyme Weekly 8-Ball",
    "recurring_or_one_time": "recurring",
    "room_id": "6",
    "roomSlug": "big-tyme-billiards-spring-tx",
    "room": "Big Tyme Billiards",
    "city": "Spring",
    "state": "Texas",
    "tournament_director": "",
    "entry_fee": "$20",
    "added_money": "$200 added",
    "payout_structure": "Top 8 paid",
    "race_format": "Race to 4",
    "discipline": "8-ball",
    "fargo_cap": "650 Cap",
    "handicap_rules": "BCA Rules",
    "break_rules": "Winner Break",
    "alternate_break": false,
    "start_time": "7:00 PM",
    "registration_deadline": "6:45 PM",
    "weekly_recurring_day": "Thursday",
    "monthly_special_flags": false,
    "flyer_image": "/images/feature-9ball.jpg",
    "registration_link": "https://bigtymebilliards.com",
    "contact_info": "(281) 288-0800",
    "player_capacity": 32,
    "bracket_system_used": "Paper Bracket",
    "livestream_link": "",
    "source_attribution": ["Facebook page"]
  },
  {
    "id": "6",
    "slug": "q-master-monthly-one-pocket",
    "tournament_name": "Q-Master Monthly One Pocket",
    "recurring_or_one_time": "recurring",
    "room_id": "7",
    "roomSlug": "q-master-billiards-virginia-beach-va",
    "room": "Q-Master Billiards",
    "city": "Virginia Beach",
    "state": "Virginia",
    "tournament_director": "",
    "entry_fee": "$50",
    "added_money": "$1000 added",
    "payout_structure": "Auction + Entry",
    "race_format": "Race to 3",
    "discipline": "one pocket",
    "fargo_cap": "Open",
    "handicap_rules": "Open Event",
    "break_rules": "Alternate Break",
    "alternate_break": true,
    "start_time": "12:00 PM",
    "registration_deadline": "11:00 AM",
    "weekly_recurring_day": "Saturday",
    "monthly_special_flags": true,
    "flyer_image": "/images/feature-room.jpg",
    "registration_link": "https://q-masters.com",
    "contact_info": "(757) 499-8900",
    "player_capacity": 64,
    "bracket_system_used": "CompuSport",
    "livestream_link": "https://youtube.com/@QMaster",
    "source_attribution": ["Official website"]
  }
]
